URL,Version,Status,OIDs,Name,Title,Descriptino,Uses,Used,Sources
http://hl7.org/cda/stds/core/ValueSet/CDAActClass,2.0.0-sd,draft,,CDAActClass,CDAActClass,"A code specifying the major type of Act that this Act-instance represents.","StructureDefinition/fr-core-clinical-document,StructureDefinition/fr-core-service-event,StructureDefinition/fr-core-order,StructureDefinition/fr-core-authorization","THO (V3)"
http://hl7.org/cda/stds/core/ValueSet/CDAActMood,2.0.0-sd,draft,,CDAActMood,CDAActMood,"A code distinguishing whether an Act is conceived of as a factual statement or in some other manner as a command, possibility, goal, etc.","StructureDefinition/fr-core-clinical-document,StructureDefinition/fr-core-service-event,StructureDefinition/fr-core-authorization,StructureDefinition/fr-core-parent-document","THO (V3)"
http://hl7.org/cda/stds/core/ValueSet/CDAActMoodIntent,2.0.0-sd,draft,,CDAActMoodIntent,CDAActMoodIntent,"An intention or plan to perform a service.","StructureDefinition/fr-core-order","THO (V3)"
http://hl7.org/cda/stds/core/ValueSet/CDAActRelationshipType,2.0.0-sd,draft,,CDAActRelationshipType,CDAActRelationshipType,"A code specifying the meaning and purpose of every ActRelationship instance. Each of its values implies specific constraints to what kinds of Act objects can be related and in which way.","StructureDefinition/fr-core-documentation-of","THO (V3)"
http://hl7.org/cda/stds/core/ValueSet/CDAContextControl,2.0.0-sd,draft,,CDAContextControl,CDAContextControl,"A code that specifies how an ActRelationship or Participation contributes to the context of an Act, and whether it may be propagated to descendent Acts whose association allows such propagation.","StructureDefinition/fr-core-record-target,StructureDefinition/fr-core-author,StructureDefinition/fr-core-data-enterer,StructureDefinition/fr-core-participant,StructureDefinition/fr-core-informant,StructureDefinition/fr-core-legal-authenticator","THO (V3)"
http://hl7.org/cda/stds/core/ValueSet/CDAEntityCode,2.0.0-sd,draft,,CDAEntityCode,CDAEntityCode,"A value representing the specific kind of Entity the instance represents.","StructureDefinition/fr-core-authoring-device","THO (V3)"
http://hl7.org/cda/stds/core/ValueSet/CDAEntityNameUse,2.0.0-sd,draft,,CDAEntityNameUse,CDAEntityNameUse,"A set of codes advising a system or user which name in a set of names to select for a given purpose - limited to values allowed in original CDA definition","StructureDefinition/fr-core-name,StructureDefinition/fr-core-person","THO (V3)"
http://hl7.org/cda/stds/core/ValueSet/CDAInformationRecipientRole,2.0.0-sd,draft,,CDAInformationRecipientRole,CDAInformationRecipientRole,"Used to represent the role(s) of those who should receive a copy of a document - limited to values allowed in original CDA definition","StructureDefinition/fr-core-intended-recipient","THO (V3)"
http://hl7.org/cda/stds/core/ValueSet/CDANullFlavor,2.0.0-sd,draft,,CDANullFlavor,CDANullFlavor,"CDA NullFlavors - limited to values allowed in original CDA definition","StructureDefinition/fr-core-clinical-document,StructureDefinition/fr-core-information-recipient,StructureDefinition/fr-core-service-event,StructureDefinition/fr-core-authoring-device,StructureDefinition/fr-core-associated-entity,StructureDefinition/fr-core-documentation-of,StructureDefinition/fr-core-person,StructureDefinition/fr-core-related-entity,StructureDefinition/fr-core-component-of,StructureDefinition/fr-core-represented-organization,StructureDefinition/fr-core-order,StructureDefinition/fr-core-participant,StructureDefinition/fr-core-represented-custodian-organization,StructureDefinition/fr-core-patient-role,StructureDefinition/fr-core-informant,StructureDefinition/fr-core-legal-authenticator,StructureDefinition/fr-core-record-target,StructureDefinition/fr-core-data-enterer,StructureDefinition/fr-core-author,StructureDefinition/fr-core-performer,StructureDefinition/fr-core-patient,StructureDefinition/fr-core-parent-document,StructureDefinition/fr-core-intended-recipient,StructureDefinition/fr-core-assigned-custodian,StructureDefinition/fr-core-name,StructureDefinition/fr-core-assigned-entity,StructureDefinition/fr-core-custodian,StructureDefinition/fr-core-inFulfillment-of,StructureDefinition/fr-core-related-document,StructureDefinition/fr-core-authorization,StructureDefinition/fr-core-assigned-author,StructureDefinition/fr-core-authenticator","THO (V3)"
http://hl7.org/cda/stds/core/ValueSet/CDAParticipationType,2.0.0-sd,draft,,CDAParticipationType,CDAParticipationType,"A code specifying the meaning and purpose of every Participation instance. Each of its values implies specific constraints on the Roles undertaking the participation. Limited to values allowed in original CDA definition","StructureDefinition/fr-core-record-target,StructureDefinition/fr-core-author,StructureDefinition/fr-core-data-enterer,StructureDefinition/fr-core-custodian,StructureDefinition/fr-core-informant,StructureDefinition/fr-core-authenticator,StructureDefinition/fr-core-legal-authenticator","THO (V3)"
http://hl7.org/cda/stds/core/ValueSet/CDARoleClassAssociative,2.0.0-sd,draft,,CDARoleClassAssociative,CDARoleClassAssociative,"A general association between two entities that is neither partitive nor ontological.","StructureDefinition/fr-core-associated-entity","THO (V3)"
http://hl7.org/cda/stds/core/ValueSet/CDARoleClassMutualRelationship,2.0.0-sd,draft,,CDARoleClassMutualRelationship,CDARoleClassMutualRelationship,"A relationship that is based on mutual behavior of the two Entities as being related. The basis of such relationship may be agreements (e.g., spouses, contract parties) or they may be de facto behavior (e.g. friends) or may be an incidental involvement with each other (e.g. parties over a dispute, siblings, children).","StructureDefinition/fr-core-related-entity","THO (V3)"
http://hl7.org/cda/stds/core/ValueSet/CDARoleCode,2.0.0-sd,draft,,CDARoleCode,CDARoleCode,"A set of codes further specifying the kind of Role; specific classification codes for further qualifying RoleClass codes.","StructureDefinition/fr-core-associated-entity,StructureDefinition/fr-core-assigned-entity","THO (V3)"
http://hl7.org/cda/stds/core/ValueSet/CDASetOperator,2.0.0-sd,draft,,CDASetOperator,CDASetOperator,"Determins the intersectionality of multiple sets","StructureDefinition/fr-core-service-event,StructureDefinition/fr-core-participant","THO (V3)"
http://hl7.org/cda/stds/core/ValueSet/CDASignatureCode,2.0.0-sd,draft,,CDASignatureCode,CDASignatureCode,"A set of codes specifying whether and how the participant has attested his participation through a signature - limited to values allowed in original CDA definition.  **Note:** CDA Release One represented either an intended (`X`) or actual (`S`) authenticator. CDA Release Two only represents an actual authenticator, so has deprecated the value of `X`.","StructureDefinition/fr-core-authenticator,StructureDefinition/fr-core-legal-authenticator","THO (V3)"
http://hl7.org/fhir/ValueSet/address-type,4.0.1,active,"2.16.840.1.113883.4.642.3.69",AddressType,AddressType,"The type of an address (physical / postal).","StructureDefinition/PatientDocument","hl7.fhir.r4.core"
http://hl7.org/fhir/ValueSet/address-use,4.0.1,active,"2.16.840.1.113883.4.642.3.67",AddressUse,AddressUse,"The use of an address.","StructureDefinition/PatientDocument","hl7.fhir.r4.core"
http://hl7.org/fhir/ValueSet/administrative-gender,4.0.1,active,"2.16.840.1.113883.4.642.3.1",AdministrativeGender,AdministrativeGender,"The gender of a person used for administrative purposes.","StructureDefinition/fr-patient-fhir-document,StructureDefinition/fr-practitioner-document","hl7.fhir.r4.core"
http://hl7.org/fhir/ValueSet/all-languages,4.0.1,active,"2.16.840.1.113883.4.642.3.21",AllLanguages,All Languages,"This value set includes all possible codes from BCP-47 (http://tools.ietf.org/html/bcp47)","StructureDefinition/fr-core-clinical-document","hl7.terminology.r4"
http://hl7.org/fhir/ValueSet/bundle-type,4.0.1,active,"2.16.840.1.113883.4.642.3.620",BundleType,BundleType,"Indicates the purpose of a bundle - how it is intended to be used.","StructureDefinition/fr-bundle-document","hl7.fhir.r4.core"
http://hl7.org/fhir/ValueSet/c80-practice-codes,4.0.1,active,"2.16.840.1.113883.3.88.12.80.72",PracticeSettingCodeValueSet,Practice Setting Code Value Set,"This is the code representing the clinical specialty of the clinician or provider who interacted with, treated, or provided a service to/for the patient. The value set used for clinical specialty has been limited by HITSP to the value set reproduced from HITSP C80 Table 2-149 Clinical Specialty Value Set Definition.","StructureDefinition/fr-practitionerRole-document","SCT"
http://hl7.org/fhir/ValueSet/common-tags,4.0.1,draft,"2.16.840.1.113883.4.642.3.79",CommonTags,Common Tags,"Common Tag Codes defined by FHIR project","StructureDefinition/fr-patient-fhir-document,StructureDefinition/fr-Composition-document","THO"
http://hl7.org/fhir/ValueSet/composition-attestation-mode,4.0.1,draft,"2.16.840.1.113883.4.642.3.238",CompositionAttestationMode,CompositionAttestationMode,"The way in which a person authenticated a composition.","StructureDefinition/fr-Composition-document","hl7.fhir.r4.core"
http://hl7.org/fhir/ValueSet/composition-status,4.0.1,draft,"2.16.840.1.113883.4.642.3.241",CompositionStatus,CompositionStatus,"The workflow/clinical status of the composition.","StructureDefinition/fr-Composition-document","hl7.fhir.r4.core"
http://hl7.org/fhir/ValueSet/contactentity-type,4.0.1,draft,"2.16.840.1.113883.4.642.3.416",ContactEntityType,Contact entity type,"This example value set defines a set of codes that can be used to indicate the purpose for which you would contact a contact party.","StructureDefinition/fr-Organization-document","THO"
http://hl7.org/fhir/ValueSet/days-of-week,4.0.1,active,"2.16.840.1.113883.4.642.3.512",DaysOfWeek,DaysOfWeek,"The days of the week.","StructureDefinition/fr-practitionerRole-document","hl7.fhir.r4.core"
http://hl7.org/fhir/ValueSet/device-nametype,4.0.1,draft,"2.16.840.1.113883.4.642.3.1083",DeviceNameType,DeviceNameType,"The type of name the device is referred by.","StructureDefinition/fr-device-document","hl7.fhir.r4.core"
http://hl7.org/fhir/ValueSet/device-status,4.0.1,draft,"2.16.840.1.113883.4.642.3.209",FHIRDeviceStatus,FHIRDeviceStatus,"The availability status of the device.","StructureDefinition/fr-device-document","hl7.fhir.r4.core"
http://hl7.org/fhir/ValueSet/device-status-reason,4.0.1,draft,"2.16.840.1.113883.4.642.3.1081",FHIRDeviceStatusReason,FHIRDeviceStatusReason,"The availability status reason of the device.","StructureDefinition/fr-device-document","THO"
http://hl7.org/fhir/ValueSet/doc-typecodes,4.0.1,draft,"2.16.840.1.113883.4.642.3.240",FHIRDocumentTypeCodes,FHIR Document Type Codes,"FHIR Document Codes - all LOINC codes where scale type = 'DOC'.","StructureDefinition/fr-core-clinical-document,StructureDefinition/fr-Composition-document,StructureDefinition/fr-core-parent-document","LOINC"
http://hl7.org/fhir/ValueSet/document-classcodes,4.0.1,active,"2.16.840.1.113883.3.88.12.80.46",DocumentClassValueSet,Document Class Value Set,"This is the code specifying the high-level kind of document (e.g. Prescription, Discharge Summary, Report, etc.). Note: Class code for documents comes from LOINC, and is based upon one of the following:The type of service described by the document. It is described at a very high level in Section 7.3 of the LOINC Manual. The type study performed. It was determined by identifying modalities for study reports. The section of the chart where the document is placed. It was determined from the SETs created for Claims Attachment requests.","StructureDefinition/fr-Composition-document","LOINC"
http://hl7.org/fhir/ValueSet/document-relationship-type,4.0.1,draft,"2.16.840.1.113883.4.642.3.244",DocumentRelationshipType,DocumentRelationshipType,"The type of relationship between documents.","StructureDefinition/fr-Composition-document","hl7.fhir.r4.core"
http://hl7.org/fhir/ValueSet/http-verb,4.0.1,active,"2.16.840.1.113883.4.642.3.624",HTTPVerb,HTTPVerb,"HTTP verbs (in the HTTP command line). See [HTTP rfc](https://tools.ietf.org/html/rfc7231) for details.","StructureDefinition/fr-bundle-document","hl7.fhir.r4.core"
http://hl7.org/fhir/ValueSet/identifier-type,4.0.1,active,"2.16.840.1.113883.4.642.3.45",Identifier Type Codes,IdentifierType,"A coded type for an identifier that can be used to determine which identifier to use for a specific purpose.","StructureDefinition/fr-patient-fhir-document","THO (V2)"
http://hl7.org/fhir/ValueSet/identifier-use,4.0.1,active,"2.16.840.1.113883.4.642.3.57",IdentifierUse,IdentifierUse,"Identifies the purpose for this identifier, if known .","StructureDefinition/fr-patient-fhir-document","hl7.fhir.r4.core"
http://hl7.org/fhir/ValueSet/languages,4.0.1,draft,"2.16.840.1.113883.4.642.3.20",CommonLanguages,Common Languages,"This value set includes common codes from BCP-47 (http://tools.ietf.org/html/bcp47)","StructureDefinition/fr-patient-fhir-document,StructureDefinition/fr-practitioner-document,StructureDefinition/fr-Composition-document,StructureDefinition/fr-practitionerRole-document,StructureDefinition/fr-bundle-document,StructureDefinition/fr-Organization-document,StructureDefinition/fr-device-document","hl7.terminology.r4"
http://hl7.org/fhir/ValueSet/link-type,4.0.1,active,"2.16.840.1.113883.4.642.3.423",LinkType,LinkType,"The type of link between this patient resource and another patient resource.","StructureDefinition/fr-patient-fhir-document","hl7.fhir.r4.core"
http://hl7.org/fhir/ValueSet/name-use,4.0.1,active,"2.16.840.1.113883.4.642.3.65",NameUse,NameUse,"The use of a human name.","StructureDefinition/fr-patient-fhir-document,StructureDefinition/fr-human-name-document","hl7.fhir.r4.core"
http://hl7.org/fhir/ValueSet/organization-type,4.0.1,draft,"2.16.840.1.113883.4.642.3.414",OrganizationType,Organization type,"This example value set defines a set of codes that can be used to indicate a type of organization.","StructureDefinition/fr-Organization-document","THO"
http://hl7.org/fhir/ValueSet/patient-contactrelationship,4.0.1,active,"2.16.840.1.113883.4.642.3.1130",PatientContactRelationship,Patient Contact Relationship ,"The nature of the relationship between the patient and the contact person.","StructureDefinition/fr-patient-fhir-document","THO (V2)"
http://hl7.org/fhir/ValueSet/resource-types,4.0.1,active,"2.16.840.1.113883.4.642.3.27",ResourceType,ResourceType,"One of the resource types defined as part of this version of FHIR.","StructureDefinition/fr-Composition-document","hl7.fhir.r4.core"
http://hl7.org/fhir/ValueSet/search-entry-mode,4.0.1,active,"2.16.840.1.113883.4.642.3.622",SearchEntryMode,SearchEntryMode,"Why an entry is in the result set - whether it's included as a match or because of an _include requirement, or to convey information or warning information about the search process.","StructureDefinition/fr-bundle-document","hl7.fhir.r4.core"
http://hl7.org/fhir/ValueSet/security-labels,4.0.1,active,"2.16.840.1.113883.4.642.3.47",All Security Labels,SecurityLabels,"A single value set for all security labels defined by FHIR.","StructureDefinition/fr-patient-fhir-document,StructureDefinition/fr-Composition-document",
http://hl7.org/fhir/ValueSet/udi-entry-type,4.0.1,draft,"2.16.840.1.113883.4.642.3.211",UDIEntryType,UDIEntryType,"Codes to identify how UDI data was entered.","StructureDefinition/fr-device-document","hl7.fhir.r4.core"
http://terminology.hl7.org/ValueSet/v3-ActClassClinicalDocument,3.0.0,active,"2.16.840.1.113883.1.11.13948",ActClassClinicalDocument,ActClassClinicalDocument,"A clinical document is a documentation of clinical observations and services, with the following characteristics: (1) Persistence - A clinical document continues to exist in an unaltered state, for a time period defined by local and regulatory requirements; (2) Stewardship - A clinical document is maintained by a person or organization entrusted with its care; (3) Potential for authentication - A clinical document is an assemblage of information that is intended to be legally authenticated; (4) Wholeness - Authentication of a clinical document applies to the whole and does not apply to portions of the document without the full context of the document; (5) Human readability - A clinical document is human readable.""","StructureDefinition/fr-core-parent-document","THO (V3)"
http://terminology.hl7.org/ValueSet/v3-ActCode,3.0.0,active,,ActCode,v3 Code System ActCode,"A code specifying the particular kind of Act that the Act-instance represents within its class.  Constraints:  The kind of Act (e.g. physical examination, serum potassium, inpatient encounter, charge financial transaction, etc.) is specified with a code from one of several, typically external, coding systems.  The coding system will depend on the class of Act, such as LOINC for observations, etc. Conceptually, the Act.code must be a specialization of the Act.classCode. This is why the structure of ActClass domain should be reflected in the superstructure of the ActCode domain and then individual codes or externally referenced vocabularies subordinated under these domains that reflect the ActClass structure. Act.classCode and Act.code are not modifiers of each other but the Act.code concept should really imply the Act.classCode concept. For a negative example, it is not appropriate to use an Act.code ""potassium"" together with and Act.classCode for ""laboratory observation"" to somehow mean ""potassium laboratory observation"" and then use the same Act.code for ""potassium"" together with Act.classCode for ""medication"" to mean ""substitution of potassium"". This mutually modifying use of Act.code and Act.classCode is not permitted.","StructureDefinition/fr-Composition-document,StructureDefinition/fr-core-order,StructureDefinition/fr-core-authorization","THO (V3)"
http://terminology.hl7.org/ValueSet/v3-ActPriority,3.0.0,active,"2.16.840.1.113883.1.11.16866",ActPriority,ActPriority,"A code or set of codes (e.g., for routine, emergency,) specifying the urgency under which the Act happened, can happen, is happening, is intended to happen, or is requested/demanded to happen.    *Discussion:* This attribute is used in orders to indicate the ordered priority, and in event documentation it indicates the actual priority used to perform the act. In definition mood it indicates the available priorities.","StructureDefinition/fr-core-order","THO (V3)"
http://terminology.hl7.org/ValueSet/v3-ActRelationshipAuthorizedBy,3.0.0,active,"2.16.840.1.113883.1.11.19965",ActRelationshipAuthorizedBy,ActRelationshipAuthorizedBy,"A relationship in which the target act authorizes or certifies the source act.","StructureDefinition/fr-core-authorization","THO (V3)"
http://terminology.hl7.org/ValueSet/v3-ActRelationshipFulfills,2.0.0,active,"2.16.840.1.113883.1.11.10342",ActRelationshipFulfills,ActRelationshipFulfills,"The source act fulfills (in whole or in part) the target act. Source act must be in a mood equal or more actual than the target act.","StructureDefinition/fr-core-inFulfillment-of","THO (V3)"
http://terminology.hl7.org/ValueSet/v3-ActRelationshipHasComponent,3.0.0,active,"2.16.840.1.113883.1.11.10318",ActRelationshipHasComponent,ActRelationshipHasComponent,"A collection of sub-services as steps or subtasks performed for the source service. Services may be performed sequentially or concurrently.","StructureDefinition/fr-core-component-of","THO (V3)"
http://terminology.hl7.org/ValueSet/v3-ActStatus,3.0.0,active,"2.16.840.1.113883.1.11.15933",ActStatus,ActStatus,"Contains the names (codes) for each of the states in the state-machine of the RIM Act class.","StructureDefinition/fr-core-clinical-document,StructureDefinition/fr-core-authorization","THO (V3)"
http://terminology.hl7.org/ValueSet/v3-ConfidentialityClassification,2014-03-26,active,"2.16.840.1.113883.1.11.10228",v3.ConfidentialityClassification,V3 Value SetConfidentialityClassification," Set of codes used to value Act.Confidentiality and Role.Confidentiality attribute in accordance with the definition for concept domain ""Confidentiality"".","StructureDefinition/fr-Composition-document","THO (V3)"
http://terminology.hl7.org/ValueSet/v3-EntityClassDevice,3.0.0,active,"2.16.840.1.113883.1.11.11623",EntityClassDevice,EntityClassDevice,"A subtype of ManufacturedMaterial used in an activity, without being substantially changed through that activity. The kind of device is identified by the code attribute inherited from Entity.    *Usage:* This includes durable (reusable) medical equipment as well as disposable equipment.","StructureDefinition/fr-core-authoring-device","THO (V3)"
http://terminology.hl7.org/ValueSet/v3-EntityClassLivingSubject,3.0.0,active,"2.16.840.1.113883.1.11.10884",EntityClassLivingSubject,EntityClassLivingSubject,"Anything that essentially has the property of life, independent of current state (a dead human corpse is still essentially a living subject.)","StructureDefinition/fr-core-person,StructureDefinition/fr-core-patient","THO (V3)"
http://terminology.hl7.org/ValueSet/v3-EntityClassOrganization,3.0.0,active,"2.16.840.1.113883.1.11.10889",EntityClassOrganization,EntityClassOrganization,"A social or legal structure formed by human beings.","StructureDefinition/fr-core-represented-organization,StructureDefinition/fr-core-represented-custodian-organization,StructureDefinition/fr-core-intended-recipient","THO (V3)"
http://terminology.hl7.org/ValueSet/v3-EntityDeterminer,3.0.0,active,"2.16.840.1.113883.1.11.10878",EntityDeterminer,EntityDeterminer,"EntityDeterminer in natural language grammar is the class of words that comprises articles, demonstrative pronouns, and quantifiers. In the RIM, determiner is a structural code in the Entity class to distinguish whether any given Entity object stands for some, any one, or a specific thing.","StructureDefinition/fr-core-person,StructureDefinition/fr-core-represented-organization,StructureDefinition/fr-core-authoring-device,StructureDefinition/fr-core-represented-custodian-organization,StructureDefinition/fr-core-patient,StructureDefinition/fr-core-intended-recipient","THO (V3)"
http://terminology.hl7.org/ValueSet/v3-Ethnicity,3.0.0,active,"2.16.840.1.113883.1.11.15836",Ethnicity,Ethnicity,"In the United States, federal standards for classifying data on ethnicity determine the categories used by federal agencies and exert a strong influence on categorization by state and local agencies and private sector organizations. The federal standards do not conceptually define ethnicity, and they recognize the absence of an anthropological or scientific basis for ethnicity classification. Instead, the federal standards acknowledge that ethnicity is a social-political construct in which an individual's own identification with a particular ethnicity is preferred to observer identification. The standards specify two minimum ethnicity categories: Hispanic or Latino, and Not Hispanic or Latino. The standards define a Hispanic or Latino as a person of ""Mexican, Puerto Rican, Cuban, South or Central America, or other Spanish culture or origin, regardless of race."" The standards stipulate that ethnicity data need not be limited to the two minimum categories, but any expansion must be collapsible to those categories. In addition, the standards stipulate that an individual can be Hispanic or Latino or can be Not Hispanic or Latino, but cannot be both.","StructureDefinition/fr-core-patient","THO (V3)"
http://terminology.hl7.org/ValueSet/v3-ManufacturerModelNameExample,2.0.0,active,"2.16.840.1.113883.11.21014",ManufacturerModelNameExample,Manufacturer Model Name Example,"An example value set representing the ManufacturerModelName concept domain used  to convey a coded name for the software used to author content.","StructureDefinition/fr-core-authoring-device","THO (V3)"
http://terminology.hl7.org/ValueSet/v3-MaritalStatus,3.0.0,active,"2.16.840.1.113883.1.11.12212",MaritalStatus,MaritalStatus,"The domestic partnership status of a person.    *Example:*Married, separated, divorced, widowed, common-law marriage.","StructureDefinition/fr-core-patient","THO (V3)"
http://terminology.hl7.org/ValueSet/v3-Race,3.0.0,active,"2.16.840.1.113883.1.11.14914",Race,Race,"In the United States, federal standards for classifying data on race determine the categories used by federal agencies and exert a strong influence on categorization by state and local agencies and private sector organizations. The federal standards do not conceptually define race, and they recognize the absence of an anthropological or scientific basis for racial classification. Instead, the federal standards acknowledge that race is a social-political construct in which an individual's own identification with one more race categories is preferred to observer identification. The standards use a variety of features to define five minimum race categories. Among these features are descent from ""the original peoples"" of a specified region or nation. The minimum race categories are American Indian or Alaska Native, Asian, Black or African American, Native Hawaiian or Other Pacific Islander, and White. The federal standards stipulate that race data need not be limited to the five minimum categories, but any expansion must be collapsible to those categories.","StructureDefinition/fr-core-patient","THO (V3)"
http://terminology.hl7.org/ValueSet/v3-ReligiousAffiliation,3.0.0,active,"2.16.840.1.113883.1.11.19185",ReligiousAffiliation,ReligiousAffiliation,"Assigment of spiritual faith affiliation","StructureDefinition/fr-core-patient","THO (V3)"
