URL,Version,Status,OIDs,Name,Title,Descriptino,Uses,Used,Sources
https://interop.esante.gouv.fr/ig/document/core/ValueSet/fr-actor-type,0.1.0,draft,,FrValueSetActorType,ValueSet - Types d'acteurs,"Jeu de valeurs pour les types d'acteurs.",,"THO (V3)"
https://interop.esante.gouv.fr/ig/document/core/ValueSet/fr-body-site,0.1.0,draft,,FrValueSetBodySite,Body Site SNOMED CT,"ValueSet pour les localisations anatomiques",,"SCT"
https://interop.esante.gouv.fr/ig/document/core/ValueSet/fr-doc-vs-code-produit,0.1.0,draft,,FrValueSetCodeProduit,Fr ValueSet Codes ATC ou CIS pour les vaccins,"Ce jeu de valeurs contient les systèmes ATC et CIS (ANSM) utilisés pour coder les vaccins.",,"Other"
https://interop.esante.gouv.fr/ig/document/core/ValueSet/fr-doc-vs-medication-administration-category,0.1.0,draft,,FrValueSetMedicationAdministrationCategory,Fr ValueSet Catégories de médicament (actes ou absence),"Combinaison des JDVs pour acte ou situation et absence de médicament",,
https://interop.esante.gouv.fr/ig/document/core/ValueSet/fr-doc-vs-participation-type,0.1.0,draft,,FRValueSetParticipationType,FR ValueSet Participation Type,"Type de participation : destinataire",,"THO (V3)"
https://interop.esante.gouv.fr/ig/document/core/ValueSet/fr-doc-vs-role-prise-charge,0.1.0,draft,,FRValueSetRolePriseCharge,Fr ValueSet RolePriseCharge,"Pour les professions 41 (Assistant de service social) et 99 (Acteur caractérisé par son rôle).",,"ans.fr.nos"
https://interop.esante.gouv.fr/ig/document/core/ValueSet/fr-doc-vs-savoir-faire-profession-chirurgien-dentiste,0.1.0,draft,,FRValueSetSavoirFaireProfessionChirurgienDentiste,Fr ValueSet Savoir-faire Profession Chirurgien-Dentiste,"Savoir-faire pour la profession 40 (Chirurgien-Dentiste)",,"ans.fr.nos"
https://interop.esante.gouv.fr/ig/document/core/ValueSet/fr-doc-vs-savoir-faire-profession-infirmier,0.1.0,draft,,FRValueSetSavoirFaireProfessionInfirmier,Fr ValueSet Savoir-faire Profession Infirmier,"Savoir-faire pour la profession 60 (Infirmier)",,"ans.fr.nos"
https://interop.esante.gouv.fr/ig/document/core/ValueSet/fr-doc-vs-savoir-faire-profession-pharmacien,0.1.0,draft,,FRValueSetSavoirFaireProfessionPharmacien,Fr ValueSet Savoir-faire Profession Pharmacien,"Savoir-faire pour la profession 21 (Pharmacien)",,"ans.fr.nos"
https://interop.esante.gouv.fr/ig/document/core/ValueSet/fr-doc-vs-type-resultat,0.1.0,draft,,FrValueSetTypeResultat,Fr ValueSet Type Resultat,"ValueSet contenant les codes LOINC autorisés pour les types de résultats",,"LOINC"
https://interop.esante.gouv.fr/ig/document/core/ValueSet/fr-doc-vs-type-savoir-faire-profession-chirurgien-dentiste,0.1.0,draft,,FRValueSetTypeSavoirFaireProfessionChirurgienDentiste,Fr ValueSet Type Savoir-faire Profession Chirurgien-Dentiste,"Type Savoir-faire pour la profession 40 (Chirurgien-Dentiste)",,"ans.fr.nos"
https://interop.esante.gouv.fr/ig/document/core/ValueSet/fr-doc-vs-type-savoir-faire-profession-infirmier,0.1.0,draft,,FRValueSetTypeSavoirFaireProfessionInfirmier,Fr ValueSet Type Savoir-faire Profession Infirmier,"Type Savoir-faire pour la profession 60 (Infirmier)",,"ans.fr.nos"
https://interop.esante.gouv.fr/ig/document/core/ValueSet/fr-doc-vs-type-savoir-faire-profession-medecin,0.1.0,draft,,FRValueSetTypeSavoirFaireProfessionMedecin,Fr ValueSet Type Savoir-faire Profession Medecin,"Type Savoir-faire pour la profession 10 (Médecin)",,"ans.fr.nos"
https://interop.esante.gouv.fr/ig/document/core/ValueSet/fr-doc-vs-type-savoir-faire-profession-pharmacien,0.1.0,draft,,FRValueSetTypeSavoirFaireProfessionPharmacien,Fr ValueSet Type Savoir-faire Profession Pharmacien,"Type Savoir-faire pour la profession 21 (Pharmacien)",,"ans.fr.nos"
https://interop.esante.gouv.fr/ig/document/core/ValueSet/fr-doc-vs-vac-type,0.1.0,draft,,FrValueSetVaccinationType,Fr ValueSet Type de vaccination,"ValueSet pour le type de vaccination. Il permet d’indiquer si l’entrée concerne une vaccination ou si l’information relative à la vaccination est absente ou inconnue.",,
https://interop.esante.gouv.fr/ig/document/core/ValueSet/fr-doc-vs-vaccine-translation,0.1.0,draft,,FrValueSetVaccineTranslation,Fr ValueSet Vaccine-Translation pour les autres codifications,"Systèmes autorisés pour les autres codifications (équivalent CDA translation).",,"Other"
https://interop.esante.gouv.fr/ig/document/core/ValueSet/fr-performer-functions,0.1.0,draft,,FrValueSetPerformerFunctionParticipant,Fonctions du participant,"",,"THO (V3)"
https://interop.esante.gouv.fr/ig/document/core/ValueSet/fr-request-intent,0.1.0,draft,,FrValueSetRequestIntent,Intentions restreintes pour ServiceRequest,"Restriction de ServiceRequest.intent aux codes : proposal, plan et order",,"hl7.fhir.r4.core"
https://interop.esante.gouv.fr/ig/document/core/ValueSet/fr-value-set-allergie-intolerance-verification-status,0.1.0,draft,,FrValueSetAllergieIntoleranceVerificationStatus,Statuts de vérification d'une allergie ou intolérance (restreint),"Jeu de valeurs français restreint pour AllergyIntolerance.verificationStatus, incluant uniquement confirmed, unconfirmed, et refuted.",,"THO"
https://interop.esante.gouv.fr/ig/document/core/ValueSet/fr-value-set-condition-verification-status,0.1.0,draft,,FrValueSetConditionVerificationStatus,Statuts de vérification d'une condition (restreint),"Jeu de valeurs français restreint pour Condition.verificationStatus, incluant uniquement confirmed, unconfirmed, et refuted.",,"THO"
https://interop.esante.gouv.fr/ig/document/core/ValueSet/vs-emdn,0.1.0,draft,,FrValueSetEDQM,Fr ValueSet EDQM - Standard terms,"ValueSet basé sur le CodeSystem EDQM fourni par SMT",,"Other"
